{
  "id": "til_0a1b2c3d4e5f60718293a4b5",
  "org_id": "org_example",
  "team": "tm_5f3a9c2e7b1d4e6f8a0b2c4d",
  "created_by": {
    "by": "u_lena",
    "at": "2026-10-15T08:40:00.000Z"
  },
  "expires_at": "2026-10-22T08:40:00.000Z",
  "key_id": "key_a",
  "nonce_sha256": "03deb1635f966dd8e9ee36472094a3c89c0111a8c5875d127cf26de89992b072",
  "status": "pending",
  "redeemed": null,
  "revoked": null
}
